musical_froot_loop|It seems to me that the best way to fight it is by developing something else in your life that you can put your energy into. Not that that makes it go away, but it seems like it helps.
ofir2006|I'd have to disagree, after 10 years of smoking I am today crave free, it wasn't easy though.Benzos was a real bitch too, but they're forming dependency rather than addiction, there is difference, once I sorted out the reason I took benzos, I no longer needed them.
shootz-n-ladrz|I don’t think that it’s impossible for me to relapse again you know? I relapsed A LOT when I first was trying to get clean. I don’t think I had hit my bottom until I hit it finally and there was no where to go. I was also super lucky that my parents were there for me and helped me when I was ready to get clean. At this point, I have SO much to lose, I have a career, husband, house and a child. If there’s a perfect storm of shit I think it’s possible for anyone to relapse. If I do think about it, cause it does come up now and again, I remember everything I have to lose and the high isn’t enough for me to lose it.When I got clean I found something I really wanted to do and made it the most important thing to me. I worked my ass off and every time I had a craving or felt like I wanted to give up and use again I remembered my goal and how much I wanted that. I remembered all of the people in my life who believed I wouldn’t make it and I would be nothing but a “heroin whore” for the rest of my life and I would get angry and remember that I was worth it and my goal was worth it to not give up. I wanted to prove those people wrong so badly and I wanted to prove to myself that I could do this. It’s wasn’t easy and there are sometimes even nearly a decade later that I get frustrated because in my profession I have to disclose my past addiction sometimes and I nearly didn’t make it because of it. (I had to pass a “character” test and my past addiction was basically thrown in my face and I had to prove that I am a different person now than I was then. I got that anger again and used it to fight with everything I had to make my goal happen.)Sometimes, in the beginning, it really was like the programs say, 24 hours at a time, an hour at a time, ten minutes at a time you know? If it was bad, I would distract myself and wait it out, remember that it will pass, eventually it will pass and I will still be clean. Every time that I could wait it out it made it easier the next time. I didn’t really go to meetings or anything because for me they were a part of the old people I used to hang with and shit. I had a personal therapist I would see once or twice a week that I loved and comfortable with. She helped me through everything and work through a lot of issues I had.This got super long I’m sorry. I don’t know if it helps at all but idk I think you need something to believe in and something to achieve and then you’ll start to believe in yourself that you can do it and you can stay clean. I’m sorry, I ramble.
swingsandwhatnot|This is what scares me that it's something I'm going to have to deal with everyday.
tearsinrain66|That’s why you have to work your recovery for the rest of your life.
underscore_frosty|I think you hit the nail on the head. As my dad was telling me when I was in detox/inpatient psychiatric care, once you become a pickle you can never go back to being a cucumber.
vladthedracul|Yeah, it never goes away the constant struggle between "let's go get my fix" and "no". But as time passes the voice in your head that tells you to get your fix gets smaller and duller.
whatisthisabout123|Actually dude it gets so easy that you completely believe you can control stuff. I was 7 years sober, former heroin addict. I actually drank like a gentleman for 2 years and now things are starting to fall apart and I have to stop. What happens is that you actually can handle it if you’ve gotten yourself healthy for years. Then you start having a bad few months and that beer you had at lunch now sounds good when you are lonely and angry at home. Then you start using it as an escape instead of something that enhances your life. Then other things sound good and pretty soon you are content with self destruction. My point is it gets super easy, too easy in fact.
yellowmush|Addiction is forever. No matter how much clean time we have, we will always be addicts. We have to work a recovery program for the rest of our life and make that program the most important part of our life.The moment we start to believe we don’t have a problem any longer is a dangerous road to go down.
Deep_Thotz|Do you have a therapist? Seeing someone on a weekly basis can help you work through your addictions
HariTerra|You are right. I deleted my post.
NiczymPuma|I was actually planning on eating shrooms like Amanita Muscaria as they aren't really close to LSD or DMT, only gives you buzz similar to alcohol. Some of my friends already did acid, and some are planning on taking it first time with me soon (like in next 6 months).However I really don't see a deeper sense in doing psychodelics. As for me it is type of a drug I really would like doing only once or two, I used to play video games a lot and I came to realisation that I have to stop escaping into other worlds, I just like our world as it is, without superpowers and unicorns :)I had a talk with my friend not so long ago where I explained to him that as for me being on acid is just like putting VR gogles onHowever I never did anything like this (neither acid or vr gogles) so take this comment with huge dose of ..... (I don't really know an english word for it but I assume you know what I mean)
None|[deleted]
PurpleSweetz|Addiction is a disease of *more* - it goes far deeper than drugs, let alone any one type of drug. For me, anything that gives me pleasure, my mind wants me to keep doing it in excess until I hate it or I end up causing destruction in my life.
helpfulsj|Thanks for understanding where I am coming from. I think that when done properly and in a safe setting the majority of the time psychedelics can be beneficial, for healthy individuals. It can be risky when you are battling mental illness. The right setting is pretty hard to achieve for "healing" purposes. For example, most people do not know real shamans and have the ability/time to really be with a tribe of people that understand how to guide someone on a psychedelic experience. the majority of people will just cop a few doses of DMT and when its over they will still have the same using buddies, the same pressures to keep using drugs, the same consequences from there using that keeps them coming back, the same mental illness possibly causing the substance abuse disorder. They will still have the same hijacked dopamine and neurotransmitter systems.There is a lot that goes into getting out of addiction and the mental aspect is just one part of it. There has to be basically a whole lifestyle and environment change to take place for the majority of people. For some people psychedelics launch that individual on the right path, for others it takes them down a very dissociative road where they become disconnected from themselves and reality. Do some more research on prolonged DMT use and look for the bad experiences.
mrtrav50|Strike when the coals are hot.. If you can go to treatment, id say do it. Its not a perfect solution but can give some structure with no using.. The voice that says im not ready will not just go away. To make it happen needed a leap of faith through the fear. Thats my experience anyway, havent had to use in a little over 9 years. Best of luck my friend!
Disasteroflife|Thank you for this. My parents spent about $18k on my last rehab trip back in October/November. I am on private insurance through their work. I was supposed to be taken off the insurance at the end of March because it's too expensive for them. I'm pretty sure I'm going to fess up to my counselor in the morning, who will in turn contact my probation officer, so I'm thinking I might see jail time. At this point, I just can't fight it anymore. I just need to be honest and say I'm not in control and take the consequences. I just feel so terrible for putting then through this. They are in their mid/late 60's and I'm putting them through hell. My dad has had two heart attacks in the last 4 years. I just get extremely down and depressed and it seems like nothing is real and I just do what my brain tells me to to survive. I'm not trying to make excuses, I could have tried to reach out. It is like auto pilot takes control and I can't think past it to the bigger picture. I've just been locked downstairs in my room since my father called me. I have no excuses for what I've done. I was so depressed the night before last that I was hurting physically. I'm going to call my counselor in the morning and just do whatever is advised, and tell him me being here is too dangerous, so whatever I need to do to get myself away from my family so I don't hurt them anymore I will do. I am terrified. But this just keeps going in circles and I keep fucking up. Sorry for the rant, I really appreciate you taking the time to reach out. I hope I am salvageable. And if not, I hope I get put somewhere where I won't do so much harm to those I love.
Modric-87|Just wanna say my story is almost similar man! You are not alone in your room, I aint leaving mine either. Im just to scared to reach out for help AGAIN and fail AGAIN. Im so done with this and all the people around me are done with my "so called" addiction problems, like anyone gives a shit.
musical_froot_loop|I hear you and I see your struggle. As you go through this process, be on the lookout for people who are kind; people who are wise; people who have something to teach you. Going to jail by itself has pros and cons. I appreciate that you want to take responsibility for your actions. But if you do end up doing time, find the people and activities and ideas that can help you become a better person. I do wish you well. My heart breaks for you as it does for my son.
only1interest|Is it possible to go back to rehab?  Four months shows you can live clean, people relapse, it can take more than one try.  Stopping what you are doing and staying clean is the only way you can make it up to people and get a do over on your life.  You can do it.
TravelPulse|The thing about opioid addiction is that it can happen to anyone. People both young and old have been affected by it. I saw a story on the news about a young kid that went to have their wisdom teeth out and was prescribed an opioid pain medication and wound up getting addicted. I don't think that anybody WANTS to be addicted if they are in pain, but it happens. [I hope this](https://www.drugrehab.com/support/interventions/convincing-parents/) will help. It's about how to discuss rehab with your parent if you believe they need some help.Good luck to you and your family!
musical_froot_loop|I am currently reading Gabor Maté’s In the Realm of Hungry Ghosts. He does a good job explaining why some people get addicted and others do not.
Modric-87|I have the same, so my addiction says: Well you better keep on using, you are already done anyway, better have some small fun before it ends. It are all lies, you dont know whats gonna happen in the future, I try to focus on only today.
SebbyHafen|Stay strong my man, the future is bright ❤️
cherrycarnage|Yeah I get those thoughts too, best thing I try to do is distract myself with work. Overthinking just hits me harder at night when I’m trying to sleep :/
justanotheraddict81|Well u have ppl that care and if ur at a loss for caring ppl to talk to m, I’m here. Like I said I’m only on day 2 of my recovery but if I can be of any help even if u just need to vent to someone, plz feel free to message me. Us addicts in recovery need to stick together. Sometimes all an addict in recovery is other addicts in recovery. So just plz know, I’m hear!!
laughs_at_things_|I never worried about the inevitability of death, but I have had experience with obsessive, unshakable worry about something that was beyond my control.  Because that's what this seems to me.  I don't think anyone telling the reasons why you shouldn't worry about this shit will actually help you stop worrying.  It's like telling a depressed person all the reasons why they should be happy.  It's just wasted breath.I'll be honest, what finally helped me was staying away from drugs and taking prescription anti-anxiety meds, and it sounds like you're already doing that...When it comes to obsessiveness, it is possible to replace your worries with something else.  Like you can't just stop worrying, but you can replace it.  Is life meaningless?  Does that cause you pain?  Well that pain is something.  Channel that into some sort of catharsis.  Art? sports?  Whatever the hell you want, the world is your oyster.I know it probably won't help but here's my two cents on existential worrying.  You worry about your life ending because you like being alive, right?  Well, I do too, let's talk about that instead.  Kierkegaard, the quintessential existentialist, said that you have to live life before you can say much about it.  Well I say that if you never get around to saying something about it, well thats ok.  I'm alive now, and that's all I ever really wanted anyway, to be alive.
zephyrbird1111|I totally get the numbing thing. I'm pretty sure those of us who become addicts, do so because we are human & have deep hurts with no instruction manual on how to heal our emotional pain. And we are all different & we all worry about whatever we worry about. That's honestly not a very long time using, so you may be just fine. I just thought I'd share a little of what I know, in hopes of giving you ideas or calming some of the things rattling around your brain. Focus on not going backwards every day, because that will only make things worse & add more worry. I hope you have some sort of a support system, because I've learned, even if that's one person, one online group or one meeting, it's an important thing to not feel alone.
GunnerMcGrath|My recommendation would be to go find a support group for YOU that is related to your child's addiction. Alanon if they're alcoholics, naranon if they're drug addicts, etc.  These are groups for family members of addicts. The key thing here is that people don't become addicts in a vacuum, and there is often both influence from family members and an influence on the family members when an addict is involved. So just having an addict in your family means there are some things in YOU that you probably aren't even aware of, that need working out.  One very common one is enabling/codependency. I'm not saying you're a codependent just because you're considering paying your child's legal bills, but I am saying that what you think is helping them may only be serving to protect them from the consequences of their actions, which prevents them from having the motivation to change.  As long as you are bailing them out, their addiction is not their own problem, it's yours.Support groups will help teach you how to tell the difference between reasonable and unreasonable types of support, and they'll come along side you to help you stand firm in the right decisions when your child pushes back, guilt trips you, etc.
Modric-87|Thats for each one to decide themselves.
Pandadeadbear|As an 18 year old whos parents put through treatment, you have to hit bottom and realize that its life or death. You can put all this recovery on them but as the top comment is telling you: youre delaying the inevitable. They will fall unless they do it for themselves, not to appease you.
SOmuch2learn|It is not your responsibility to fix your son or daughter who is suffering from addiction. You can't.
brokenhalfjap|Yes! And let them know that you love them and support them, but you DO NOT support their habit. Give them all the love and support you can but nothing that can be used to buy drugs. Hell, let them detox on your couch. As long as they’re not using or stealing from you, be there for them.
farkalark|yes, monetary resources, but emotional support and resources do not cost anything, as long as you do not lose yourself in the process..helping takes alot.  to watch a family member go through addiction, hurts, and to offer support sometimes takes its toll, to offer good support that is beneficial to the addict, comes at a price, emotional toll, you have to learn how to do that without sacrificing yourself, but as well offer meaningful support.
florabundawonder|I would simply say that no matter how much time, money or effort you put into it, you can't help someone who ultimately isn't helping themselves.
futurepilgrim|Good luck to you and your child.
helpfulsj|I'm a recovering addict of almost 7 years, my parents have been in recovery for almost 30, and my older sister is still in prison for using.All I am going to say is that it's more important for loved ones of addicts to get help for themselves and joining a support group like Naranon, Alanon, or Families Anonymous. as well as professional therapy. It's more important for a parent to learn about how they are enabling their children to keep using, which is different for everyone. Helping your children/loved one is less about money and resources and more about setting boundaries and learning how to properly love yourself. As well as learning how you have contributed and not contributed to the problem, and most importantly that no parent has control over their kid's mental health.  Parents also need to learn that its a problem that has permanent consequences or may not ever get better regardless of how much they do for their children.
musical_froot_loop|I love this. He is still the perfect person I brought into this world. He is 22. I don’t think he is in active usage currently but he does love opioids. He’s already been through drug court. It took awhile but he finally made it out. We are in Ohio. He has met wonderful people along the way who have been really great examples of people who have come through addiction. I can’t tell you how many people have openly admired him for so many things. People have taken an interest in him. So many have demonstrated their care for him. But it’s true that it has to be what he wants. And for all the positive steps he has made, he has made some serious mis-steps. I think mental health issues are relevant as well and we are going tomorrow for an evaluation which will be a step in the right direction. I’m trying to find the right balance of support and love and recognizing whose life it is anyway.
primarybs|Yep.  That.  Guaranteed, there is something in there and once he makes peace with it..... things will get a lot easier.
GunnerMcGrath|It's not the wrong place and you are not alone. It's very self-aware of you to recognize that it feels like you are filling a void. That is a common aspect of addiction. Good luck in your search for help! You may be able to attend some AA meetings even though your problem is not with alcohol, the issues are the same.
musical_froot_loop|You’re definitely not alone. Buying something new feels good to a lot of us, addiction or not. Be gentle with yourself. This is meeting a need that you feel and you can find other ways to meet that need. Good for you for planning to find out what resources are out there.
GunnerMcGrath|http://www.nar-anon.org/ is what you want!
gogomom|r/AlAnon is a good sub to find others dealing with the same things you are.
goldprismlights|Thank you. Much appreciated!
Lulumaegolightly|Congratulations on getting clean! I really hope it works out for you. I think he is past the denial stage and knows he has a problem. Since he’s reached that point, hopefully he will be receptive to my concerns. Rather than aggressively pushing sobriety, I will definitely try to just let him know I’m there for him and worried about him and remind him that his life is worth living!!
MyDixenCider|He got clean after being in jail because he had no choice other than to be clean. If he started using after he got out means that he didn't mean to be clean. The biggest thing here that you need to learn is that an addict will not get clean or stay clean until they decide for themselves that they want to be clean. No matter how hard you try to convert them they will rebel and push further down the road. Talk to him dont be too pushy, hint at rehab or NA and he will be more receptive to it. Pushing sobriety is the last thing you want to do.
justanotheraddict81|Thnx! I hope it works out for me too! Just being there and showing u care and that ur there to support him when he decides to get clean. But be careful while he’s using, because us addicts use the ppl around us while in active addiction. Be there for him in healthy ways, don’t enable him. I hope all works out and he gets clean. Meth is a terrible drug that can turn an amazing person into....a raging lunatic. I’ve seen it firsthand. So be careful! Best of luck to u and ur brother. Please don’t hesitate to ask for further advise. I have an inside perspective into meth addiction that u don’t have. Good luck!
Deep_Thotz|Omg I am so sorry for your loss, so horrifying
SOmuch2learn|My heart goes out to you. Please find someone to talk to.
TravelPulse|I am so sorry that you are going through this. You have to be strong. Times will be tough, but they will get better. [Here's a list](https://www.drugrehab.com/addiction/hotlines/) of some free hotlines if you need anyone to talk to.
antiquespaceship|I am so sorry, please stay strong for your son and do what you can to prevent drug abuse. Stay clean and make it your purpose to identify and treat the underlying causes of drug addiction. Maybe you could make a life out of that and find true happiness through purpose and helping others
brickwallnomad|I’m terribly sorry to hear that. Must be awful. I can’t imagine that kind of pain. My heart hurts for you. However, your chances of breaking the cycle are very slim. I’m in recovery and have been clean for some time now, but I’m never promised tomorrow. Who knows if my old addict mindset will come roaring in tomorrow and next thing I know I’m right back off the deepend? So use this pain and loss, take it, own it and let it be some motivation for you to break the status quo and push. Focus. Try waking up tomorrow and not using. 1 day man. You can do it. The next few days will get worse. The next few weeks will be even worse. But then it will begin to fade and you will start to see some improvement. Maybe go to a meeting. Just for me, from my experience, I couldn’t stay clean as long as I have without somewhat regular meeting attendance. I go to NA. The hardships I faced at the beginning of my recovery slowly began to heal inside as I started to develop coping mechanisms beyond drug use. All I had known in life up until getting clean, was being high. Especially in the face of hardship. I didn’t know how to deal with emotional stress. I didn’t know how to be comfortable. Much less comfort others. Will your child be able to count on you in the future? That’s up to you. Be the person you want to be, starting today.
getyamindright|Be there for you son. Even if the family blames u that is still your child be a good person for him and make the best life for you and your son. Sorry for your lost
musical_froot_loop|I’m so sorry for your loss. I hear your pain. You didn’t say whether you also use, but if so, taking steps to getclean and sober seems like a good first step toward seeing your son again. I’m so sorry.
NiczymPuma|You have an subreddit for it? Cool, can I have a look?
thebrightorangedawn|Also interested in sub
None|[deleted]
PurpleSweetz|Much love. Thank you. You as well.
StaleToastCubes|Anytime!
brickwallnomad|Thanks man. I haven’t won yet. Getting clean is easy, it’s staying clean that u have to stay on ur toes about. No, it’s not “hard”. It’s just real easy to forget what it was like when we were using, it’s real easy for us to remember only the good times. We block out the whole reason we decided to get clean to begin with. The good times were obviously gone, for me at least. I just wanted a way out. Now that I’ve found it, I have to remind myself every so often, no matter what I do, I’ll wind up back in that mental hell if I go back.
