2soonBoone|That's definitely when you start to become addicted. At least it is when you combine it with the utter despair from sober life being so relentlessly predictable. The question then is just how bad is addiction?
Modric-87|The problem with addiction is, that really good high where you are the master and feel like a God is long gone. Our mind cant forget those times, but everytime we get high its chasing that awesome high that will never come back again. At this point sober and high life both suck and then funtime is over.
Samuelbokay|Yes. Being high was great. Tolerance built up, money gone... . Eventually being broke and homeless and family-less and all fucked up going through withdrawal was hell
TravelPulse|I've been through this on the other side of it where I see someone indulging in substance abuse. While it may feel good for whomever is taking the drug, it can hurt the people that love you and care about you.
helpfulsj|Just wait until that feeling gets taken away and you cant stop using. This is the part everyone using is afraid to acknowledge. It seems like this cool underground lifestyle until you cant stop selling yourself for a hit or end up in prison. Any illusion of light will get taken away eventually as the drugs take over your life. Any illusion of control will fade away eventually, and you stop fighting and managing your life and the only thing that will take you out of your hell is an intervention from the law or death comes knocking and takes you away or scares you enough to stay clean.>It's a pathway that no one has certainty about.Everyone knows where this leads, it's only the person that is using that uncertain and thinks it might not end poorly. Caught in the delusion. What your describing is high, and the high goes away but the addiction doesn't. It soon becomes a matter of survival that goes before anything else in your life.
theyreinwa|That's true! It might make you feel young and powerful until you get sick and tired, then it just makes you feel normal.  When being sober sucks more than being high then you're addicted.
Deloit|Yes, you're absolutely right. People have to be ready to accept things. In this case, it's difficult to get consensus on basic facts, so I may be better off remaining in the background and not saying much. To your question, "How does your GF feel about the situation?" - Well, It's an interesting situation and actually answering that question gives you a little more context on why I spoke out to begin with. As I mentioned, this has been going on for 5 years and the brother actually almost died last year of an overdose. My girlfriend has a bit of an introverted personality and struggles with asserting herself - as such, when she does try to point out these same basic realities, she is promptly shut down by her parents. They will either just deny what she is saying is true, (such as buying a car is enablement or that they bought the car at all, get bogged down in what the definition of the word 'listen' is), or just label what she is saying as negativity and engage in diminishing her general worldview and attribute her "negativity" to her worldview. SO when she DOES speak out, her thoughts barely get through the web of defense mechanisms, and the debate about her brother's addiction will often be reversed into an indictment of her thoughts and attitudes towards life.This time around, I just couldn't take it anymore and was essentially just backing up my girlfriend. She thanked me afterward for helping her have a voice, but in doing so I guess I drew a huge line in the sand and have positioned myself as a threat to their attempts to make my girlfriend complicit in the enablement of the brother (if that makes sense).
Evilevilcow|You're not wrong. But from your GF's parents perspective, you're never going to be right by pointing out things that they aren't willing to accept.Addiction effects the whole family. And until the individuals are ready to each face it, they'll stay in denial. It's difficult, but unless someone asks you, I would try not to point out obvious logic errors.  If you do, expect that they may try to hide more things from you.How does your GF feel about the situation?
grandelusions|Here's the thing, you've been together for 10 years... a decade! If you can't even voice an opinion after 10 years of family dinners, then those people aren't worth helping. I'm salty because as a recovering addict I've been with my husband on and off for 14 years, exclusively for the last 8 and married for 5. His sister is an addict and his entire family is doing everything wrong to deal with this and has been for years. Over he last year the addict and I have gotten much closer for obvious reasons (I really want to help her stay clean and know she has true support even if it's just me and her brother) and my relationship with the rest of them is faltering because of it. I've been around this family long enough to realize that it doesn't matter what I say anymore, they are going to do whatever they are going to do. I've tried my damndest to stay quiet in the past and then some things happened last summer, I got thrown into the drama and I'm an open book with them now. It's to the point where they complain about her and I bring up specific recent and past behaviors or comments they have all done/made to perpetuate the problem(if you're not a part of the solution then....) Sometimes they listen, sometimes they get super pissed, either way... they are gonna hear it. I'm my husband's wife and their sister/daughter in law, they will hear me out or they will STFU about her. Whichever they choose, no skin off my back anymore. There comes a time where you have to get over making people mad when you're working for a greater purpose. You were totally correct in what you said and if they weren't being a part of the problem, they would see you were right and work to change it. The biggest success recovery stories IMO aren't the ones who overcame abuse and disease and homelessness. They're the ones that got/stayed clean while their "caring, loving, supportive" family members actively let them carry on with their addiction. These people are letting him be an addict, they don't love him, they love the idea of what he used to be.
princesslegolas|They're butthurt because your burst their bubble of denial. The fact they call it parenting advice also suggests just how much they're in an enablement and infantilisation process.... But.. They're your SOs parents and you gave then advice they didn't ask for... Be the bigger (saner) person, call them, apologise and continue as before. If they still cant cope then you know your conscience is totally clean and its all about their hurt. Unfortunately living with and loving addicts often means picking your battles and being the bigger person, but the gift of that is you get out of their drama circle.Good luck!
retired_junkiee|It’s a delicate topic. My parents thought they were complete failures. Btw I am in recovery for multiple years now and our lives are very different. I can’t imagine what it must feel like for them. There were times my folks cut me off and did the tough love thing but they also enabled me. Addiction is cunning and baffling. When I was using i was a different person. I am sorry you and your family are going through this but there is a solution out there if he is willing to change.
ClaireDraven|This is actually wonderful information to have.Also, Mental Illness Happy Hour is fantastic!!
GunnerMcGrath|I know you're interested in other things but you may benefit from going to nar anon. Family members of addicts tend to have more baggage than they realize and those groups can be very helpful.So sorry for your loss.
goodfrienddoc|Thank you, I didnt know there was nar anon, I'll have to go to one of the meetings.
tearsinrain66|SMART Recovery is great. It’s cognitive behavioural therapy based (science based). The meetings are a great place to develop a support group. Lots of meaningful discussion. And tools that work to help the individual manage the situation and work a recovery that keeps them clean and sober. Podcasts are also great. Dopey, mental illness happy hour, etc.
ExMethCokeHead|Hope the living situation gets better.Man, I’ve been in your shoes and what kept me going was the stuff and situations I knew I could only have while clean. Set up some sober goals or things to look forward to and then focus on those. Life sucks while tying to climb back up life sucks worst using n losing.
Flip123Flup|I don't know you but, I'm an (ex)addict?. It's been 7 years Ish. And i don't even know how to begin to say I'm sorry. The situation you are in sucks. It sounds like getting past this is important to you though so I'll say this.. do what you have to do. I think your right. If rehab is the best place for you to go to find that mental health, GO. 7 days at the shelter is shit but if that's what has to be to get there, do it. Depression is the biggest reason I used I can't sit here and tell you that shit will go away just cause you're clean. It's been 7 damn years and it's still a struggle. But at least now it's a struggle that's worth something. It does get better, never any easier but better. I swear.
ThisCatMightCheerYou|>I'm sad[Here's a picture/gif of a cat,](http://random.cat/i/1376593_717282458580_867040755_n (1).jpg) hopefully it'll cheer you up :).___ I am a bot. use !unsubscribetosadcat for me to ignore you.
allahusin8|If you need someone to talk to, please don't hesitate to reach out to me.Or if you're in a real ASAP crisis please use a suicide hotline. There's even text ones and app ones if you don't like talking on the phone.
dillpickledoritos|What seems like a setback for you now could become one of your greatest opportunities for improving your life. It sounds like you should do whatever it takes to get into residential treatment. I wish you the best.
lando421|thanks, i managed to get something figured out. Yesterday was a crisis, today I am moving forward. started a youtube channel as a place of confessions and to share my story. thats what i try to focus on, other than $$$ constantly :(
ClaireDraven|Have a couple questions, am PMing you, thank you.
Samuelbokay|#1 don't beat yourself up so hard. You are an addict; it's going to take some time to change that; it's going to take some time for your people to trust you again, but they knew you before you were an addict and they know that person still exists in there. Honesty is the best way- tell your people, parents, subs, SO, the truth. And continue to tell them the truth. Get to a 12-step meeting and don't let the goofy religious talk scare you off- don't let your addictive voice convince you that you don't want to hang out with us losers. Read "the Brain That Changes Itself' by Norman Doidge, about how we create neural pathways through addictions etc, and how to re-wire your brain. Get a sponsor, love yourself eventually. Good luck.
WonderfulAfternoon|I have'nt been strugling with amphetamines but I've got some pretty good insights to many other substances. I agree with luckycatsweaters about the thing that it would be easier to start with your bf. If he really cares, he'll really walk by your side. I also think it's best to start with the fact that you have a problem.The best way to start dealing with a problem is to break and analyze it in smaller parts. The problem seems almost everytime a lot harder when you look it as a one big pile of things that has to be done at once. Problemsolving in smaller portions is a lot easier, start with small and keep going.Honesty is really the best thing. Even though you have to accept the cruel fact that you loose the trust of your closest people . But trust can be gained back. Even though it might take a long time, but it will work for you as a motivational tool not to relapse. Personally I have noticed that people are dissapointed when told the truth, but on other hand they also respect other people who are honest and tell how things really are.Respect of others is the thing you really want in this life.And my opinion about rehab/medical detox is that they might help, but stopping amphetamines and recieving bentzos or some other sedatives for getting over your detox is not the best idea. These things are mental, not physical for the most part. You have to succeed yourself mentaly and you have to have a strategy with a goal to walk that road. Not saying that the physical part is'nt hard, it is. But if the detox is too easy, the change to relapse is bigger imo.When you go trough a really difficult detox, you know you do'nt want to do it again.  And to maintain your decision and when you are on your weakest point, you really could use someone to talk with. Stay strong,never give up.
eliminatethestigma|I agree with the replies here. First of all, you are not a bad person. Your addiction is making you make poor choices because that is how this thing works. The shame that comes from addiction is a huge factor that keeps us from getting help; thus, it is what kills us. It is extremely hard, and I have done it myself, but telling people you trust is a great first step. If they love you, they will help you.  The relief that you will feel when admitting your pain will be tremendous. For me, once I admitted my addiction, I was able to begin healing and getting back to the real me. In fact, I started a blog, [shamelessly sober ](www.shamelesslysober.com)  to share my journey. The honesty has been quite therapeutic. I found support from people I never knew had addictions too.Whatever method you feel you can use, share your struggle, at your own pace. Don’t beat yourself up. Millions of people have the same issues as you. Don’t compare yourself to others. You are not weak; you are simply sick and need help. Best wishes to you. You can do it!
jmm331|Hey man - I can totally relate to the way you feel.  You’re not alone. From my experience - when you tell people who love and care about you about your problem they just love and support you in getting better and are usually relieved because they probably already have some idea that something is up, but can come to grips with asking you. I would probably not address any of the stealing or anything just yet.  Just let them know where you are at and that you need help right now and you can make amends for things you’ve done further down the road once you get right. Good luck and Godspeed. It gets better.
luckycatsweaters|I’m so sorry that you are struggling :( addiction is the single most difficult thing I have had to overcome in life, and I have nothing but heartbroken sympathy for those who are still sick and suffering.  The shitty thing about it all is that it’s *who we are* that drives us to use drugs (and situations, things, people, anything that crosses our path of self destruction), and to recover requires a complete overhaul of us as a person. I think I mentioned it in another post to the same OP, but the bittersweet thing about rock bottom is that it is a solid foundation on which you can rebuild yourself to become whoever it is you truly desire to be. You don’t have to be a prisoner of loneliness caused by your addiction, there is a better life out there waiting for you to step into it. PM me if you want to talk about it. Life is a bear and we aren’t made to handle it alone (as much as our addiction does it’s best to convince us that nobody understands us and we don’t deserve the love of those who do). It can only get better from here, friend :)
streetspirit81|Urge you to get to an NA meeting. Being with fellow addicts as well as working the 12 Sreps will help you take it day by day in battling your addiction. I'm 8 months in and would go aa far as saving it saved my life. That is providing I keep in touch with the program itself.It's brave of you to share this with us - wishing you the best of luck in your recovery
4research156|Hey, man, I just wanted to say good job. As a current addict, it's so inspiring to read these-- especially when it's in the first stages of recovery like yours. I'm so glad you survived that sucidal urge. When it hits, it hits hard its and it's almost impossible to shake off. It's something you need to ride through. From everything you've said, you've displayed so much strength. I have no doubt that you can pull through. Like you said, it's going to be rough but worth it! We're pulling for you! L x
Modric-87|Haha me too.
deanobagio|I miss you and love you sunflower.
evil_leaper|*Reads this as* "Loving this new Eminem/Russell  Brand collabo!"*Comes back from Google disappointed.*
HoneyBunch1017|Thank you, and please, take care of yourself, as well.
YeahNoYeahMaybe|So sorry for your loss. :(
swingsandwhatnot|Yes that is sad and such a shame. It is heart breaking. We should all be kinder and help other as much as we can.
ClaireDraven|Depends on what you're coming off of and how severe your withdrawal symptoms are, but in general, the rules of thumb here are: 1) Keep yourself occupied, and 2) Be around people (the sober ones, obviously), whether you want to or not. Socialization will keep your mind occupied, and human connection is essential. If you're into the god thing, then the previous commenter's suggestion, NA/AA is totally your best bet. They recommend 90 in 90: 90 meetings in 90 days. Find a sponsor and commit to it.Good luck!
SOmuch2learn|Get professional help and go to support group meetings.
clockworkbuddha|As above - there’s little per se that will make it less painful and so easier, but plenty you can do to help you bear that pain and get through it - mainly getting support and being able to tell people how you feel and letting them help you. To feel vulnerable and in need of help can feel very alien and wrong to dependents - fight that feeling and reach out
witherspleen|Hit a AA/NA meeting. It will be enlightening to be in a room full of people of all ages and walks of life with the same problem talk about their crazy histories and how they are succeeding, struggling, or just living. Some groups are tiny, some are huge. I tried a few first couple of attempts, didn’t stick for me, and to be fair, it doesn’t work for everyone. But when I got desperate for anything that would work I went back and I’m 5y clean and sober now.
GodsGeneral|Do you have insurance? With a benzo habit of that long you really want medically-assisted detox. And it will make your life infinitely more bearable for the opiate withdrawal (with clonidine, phenobarb, etc.). Your restless legs is gonna get a lot worse and your surgeries are gonna ache beyond hell. I would seek treatment. 7-10 day MAD at minimum. Followed by inpatient if feasible with insurance / employment. At least outpatient counseling and support.Life does get better. It just gets worse first. Good luck.
Katsie463|Witherspleen,Beautifully said. So nice to talk to a fellow theatre kid here. Thank you for taking the time to respond. I think the thing that will help me the most is being with my family every minute of everyday cheering me on and taking care of me when I feel the worst. They are worried about my safety but I've assured them that I will be going through withdrawals but it's nothing we can't deal with. They just want to make sure I am safe. I know that tapering is a safe way to go. I think cold turkey would be another story. I want to reassure my family that this detox is not something I can die from. My husband is not a drug user of any sort. Not even ibuprofen so he's nervous that I won't be safe. But, I think I will be safe but just super uncomfortable. My question is, tapering is a safe way right? And I know you can't die from withdrawals unless is benzos or alcohol. I just want to reassure me family. I felt confident until they got so worried and I have diagnosed OCD so now I'm worrying too. (Even though I've been through withdrawals before)
Newmommy31|I know what it's like to feel in bondage to something I'm a recovering heroin addict I went from heroin to methadone to suboxone. Its been very hard heroine withdrawal is something terrible and unexplainable but even though I'm kinda against methadone clinics because in Alabama you can't get a script you have to go to a clinic but I know a lot of people that say methadone works better for their pain than anything else. But the xanax is just dangerous I hope you get some relief
cvanagas|Hey, so first of all, I totally feel you. Life sucks being in pain, and life sucks on meds. At least, when you’re off, though, the “suck” is stable, and not constantly peaking/dropping. I have chronic daily headaches and severe TMJ. I’m in constant pain, and have been for 12 years. I started on Vicodin, getting it prescribed. They moved me to oxy’s (15mg taken once daily). Every month, I’d go to my doc and say it’s not enough.. how I couldn’t function, and was suicidal. He didn’t budge tho. I did this for years, until I finally broke, and bought heroin. I never used needles, only smoked it. And it was easy to justify, as I was taking it medicinally, not recreationally. Like you though, I ended up blowing every cent I have, and ruining my life over it. Even though I was taking them for pain, not recreationally, I still decided to put myself into treatment. I went on methodone about a year ago (I wasn’t healthy enough to do a full detox at the time). Even though I’m not a traditional addict, I still benefitted a great deal from going into treatment. The accountability (UA’s) helped me, and the reward system (if you do well, you come in less) helped as well. Also, I went to like 3-4 groups a week when I first started (wasn’t working as much) and they helped SO much. I always walked out feeling totally cleansed, like I just came out of church or something. It gave me a place to talk about my suffering, where people really cared and wanted to help. I also got to help others, which was so great for me, emotionally. So yeah, couple factors here at play. The groups are very important. Having someone to hold you accountable, so you’re not cheating, is also very important (where you can’t lie your way out of it). Having rewards in place, for doing well, is also a great idea. If I were you, I would taper, and then go on suboxone. It’s important you’re not doing this yourself... outpatient rehab at a minimum. And everyone always bashes rehab, but me personally, I loved it. I made so many great friends, and had SO many awesome people that supported me. I also learned a lot. The benzos can be super dangerous... definitely talk to your doctor about that. Also, I would NOT recommend getting off benzos, AND opiates at the same time. I’d quit the opiates first. When you quit, make sure you have someone to take care of you, who can check in on you frequently. I don’t know how far down you can taper, and how bad the w/d’s would be with ample suboxone, but you’re gonna want to be treated like you had the flu. Soup/ritz crackers. Someone to change the sheets if you get too sweaty. Massages help. Someone to make electrolyte water etc... also, sleeping pills are a must. There’s a lot more here to say, but I don’t want to give too much info. I’m about the same age as you, and I also have really bad chronic pain, so if you want to talk more, please feel free to message me. I’d even welcome a phone call as well. I’ve been thru it, lol.Take care and good luck =]
pillhead123|Suboxone over a few months was great for me, but I was in the mind set to do it.  I tried a self taper, and it was hell.  By day 3 I felt inhuman.  Off to the doctor, the hardest part was admitting that I needed help.  Once that was done, the suboxone started, and I was dubious.  I've read that people get hooked on suboxone rather than what they were taking, and never make it off of that.  I also heard that people said it was harder to quit suboxone than it was to quit what got them there in the first place.ABSOLUTELY NOT TRUE, at least not for me.The doctor started what I thought was a REALLY strong dose of Suboxone ... I think it was stronger than what I was taking, honestly, I was so high it was making me nervous, but I found out that they need to fill up all of your Opiod receptors at first since Suboxone is only a partial opiod agaonist.  From here, they stabilize your dosage over a few days and then taper gradually.I went from 8mg to 4 mg to 2 mg to .5 mg over about 6 months.  Each time things were tapered I was nervous that I'd have jitters, DT's or cravings but other than a caffeine like anxiety and maybe a headache or two in the mornings, I was normal at each taper.  The reason for this is the long acting nature of Suboxone / Bupenophrene.  This worked so well and I was able to maintain a normal work and social life without being sweaty, jittery, or anything.  If you are having a hard time I recommend doing this with your doctor.  Stay on regimen!  Don't deviate, don't slip up, and do not take more than you are prescribed, Suboxone is much stronger than oxycodone, and taking more than you should will only lengthen your taper.  If you take longer than some people, the doctor should also stretch your taper treatment out as well.  Let me know if you have any questions, I'd be happy to help.
