sukcessfulfailure|Thank you man. I appreciate the disclosure and advice more than you can imagine. And thank you for the recommendation, I’m going to watch this now. I know exactly what you mean too. I’ve realized you are right. The connections I made while sober with my co-workers, the purpose of having a job, the empowerment from having money..I believe all of that led to my happiness. And just as you surmised, I lost all of that because of school. It’s true, I have no connections at school. I cut off all my ties with local friends because they are just completely strung out and I can’t be around them. I feel completely alone because I can’t talk to my family either about these things when I need someone to talk to. When I was just working on staying sober and keeping my job it was easy for me. I had no desire to use anymore. No cravings. Nothing. It all came back with a vengeance in school. I feel it might be related to my heavy use during high school and community college. Perhaps I subconsciously connect school with drugs..I don’t know why I feel this way in school because I’m not a bad student. I get good grades..even impress my teachers with my writing abilities. It’s just all so empty to me. It doesn’t carry any meaning. I desperately want to finish my schooling and get my degree because I know, in the end, it will make me feel great about myself. It’s just the fear of the damage I will do again in the mean time. I’m afraid that if I make the drastic decision to drop out and focus on myself and sobriety again that it will just compound my depression when I realize I gave up and made no progress again. It’s a slippery slope because either way it’s a bad decision, in my opinion..I’m honestly not even sure what I’m expecting to hear but hearing I’m not alone makes a world of difference. I did manage to go to class today and stay sober. You’re also right about being proud of the experience. I feel like the places my addiction took me to, the lows, the disparity, all for me to come out triumphant in the end made me a much better person. I saw myself become extremely compassionate and empathetic. I found happiness in helping others. It just wore off on me. And I made a huge mistake going back to drugs..but the fact that I can even see this and admit it gives me hope. I know I can find the strength to get myself out of this mess again. I just wish I could force myself to do it right now. But I do feel happy I made it through just one more day. At least I came out triumphant this one day again. Hopefully I can repeat the process enough times until it becomes natural again. Anyway. Thank you for your response. Truly.
walt1o82|Relapse is part of the addict's journey unfortunately. Every relapse is an opportunity to learn though and grow understanding of your condition. The philosopher Alan Watts frames the initial realisation that you can never use again under any circumstances (Hari's ratpark is how to remain sober)Search YouTube "Alan Watts Accept it, and you'll be good at it".I'd advise to listen and ignore whoever's put the video together.Glad to hear today went well :)
DenMother8|First of all - CONGRATULATIONS! You can find new friends the same way anybody finds new friends, do things that interest you -  go to class (not just Academic, maybe something in the arts or something physical like a sport) … Go to meet up’s or other social events. Good luck - you may want to change jobs &/or move if possible.
OGpizza|Find some volunteering options in your area. Helping homeless, tutoring English, etc...not only will you make a new hobby that keeps you occupied to avoid relapse, you’ll meet people will similar interests and create new friendships. Say yes to these people when they have ideas for stuff to do outside of the volunteer setting. Eventually you’ll get to know them at a more intimate level and you can start suggesting things. Even later you can drop the volunteering altogether (unless you want to continue, then by all means keep at it!) and voila, you have a new circle of friends.
SebbyHafen|^^ yeah volunteering is good, local rec league sports,  maybe take a class from a local community collegeYo, and like...I'm Mormon af and not trynna convert you or anything, but there's always a good crew of 20 something year olds wherever you live who plan activities n shiz like once a week, doesn't matter whether or not you go to church or whatever. Good crowd to hang around. I can hook you up if you're interested.
okcomputer14|Where do you live? My home group is essentially all people in their early - mid twenties.
Cwellz123|Yeah I’m at 67 days clean and I still think about getting high. It’s going to take more than 8 days for your brain to go back to normal.
Modric-87|Im in the same mindset. I so recognize that covering up the using, so our loved ones can relax a little and think we are doing ok. I feel like a total douche to be honest about my using, because when im open about it too them, in no way I can promise them I wont use again. Its a fucked up paradox guys.
PurpleSweetz|You shouldn't worry about step work at 10 days clean. Your mind is still raging for more drugs. You should just focus on remaining clean from the drugs at all costs.
Sushisavage|I first admitted it to myself a little over a year ago. Been on and off in recovery programs since then. I was out of recovery completely from June-November and hit a bottom in November and started trying again. Fifty days was the longest clean time I've had. Now I'm at 10 days. I'm proud of myself though. I use drugs way less than I used to... that has to count for something. Lol. I don't know you or what you've done but I doubt you're a bad person. You're a person with an addiction. Addictions are fucking hard to quit man. Maybe try going to 12 step meetings and just listen. Even if you don't want to get clean at this point, just go and listen. That's all I've really done. I did get more sober time when I started doing the steps and got a sponsor, though. No rehab for me. I still hope to use and drink again sometime, just not today.
Turrbo_Jettz|You aren't ready for recovery yet from the sounds of it. You have to WANT and NEED Sobriety with every fiber of your being!
michael-satterfield|I guess that makes sense... I would suggest getting with more women in recovery. Check out some women's meetings and maybe get to know your sponsee sisters. Personally even when I was dating another person in recovery, it wasn't the best thing to rely to heavily on each other. It's too easy to start getting high together
woods8189|I like to think am not a bad person but some of the things I've done high would make me a bad person, so does that make me a bad person coz i took the drugs know it could make me in to a dick head, I struggle with that little conundrum for a while now.   It was 6 years ago for me when I first admitted to myself and started looking for professional help. They don't really do the 12 step program were am from. We have a service to help people out of addiction am engaging with them on a one to one basie, never had a group meeting yet tho, Am worried about the group meeting don't know why Yes I would say it totally dose count the amount of drugs your using. 6 year ago I was bang at everything everyday whatever i could get my hands on. 6 year later I might still be using but at least there are no class A involved anymore When I read that you still hope to use and drink someday, again exactly how I use to think, after 6 years of trying I now know that when I finally do stop it will have to be forever. Because use addict just can't handle are drugs and ruin are lives, there's no take it or leave it for us. Its just leave it. Its a scary thought it shits me up know that one day I will never take another drug again. I miss them already thinking about that and I've not even got totally clean yet
GunnerMcGrath|You're an addict, your girlfriend isn't. You're going to have to accept that you can't do drugs casually and not get obsessed. Also your girlfriend, as a non addict, is taking drugs because they're medicinal and they have uses. You're using them for recreation and to escape. That's not what those are for.Go to NA meetings. You'll learn so much about yourself just listening to others talk.
Monstiemama|This is amazing advice. Thank you.
SkyR923|I too used to experience the overwhelming urge to use drugs. It’s called being an addict. That’s what we do. I’ve been so addicted to drugs before that it completely fucked my life. I sat back and watched my whole world wither away in front of me. Then I decided I wanted to get clean, I wanted to *live*.That’s what you need to do. You need to find out who you really are without drugs. It’s not easy, trust me I know. But if you really want to get sober, you have to find I within yourself. At the end of the day, nobody can truly help you get clean other than yourself. Think about how you feel without drugs. Pretty shit, right? Well you don’t want to live that way forever. What kind of life would you be leading if you had to have drugs in order to feel okay? It’s just not healthy man. I encourage you to get some professional help. You are already taking the right steps by admitting you have a problem. You can get over this!! If I can, anyone can. Don’t let substances control your life. You are stronger than them. Although it may not feel like it, you are. You have the power to put an end to this. My heart goes out to you man, I was in your exact position once. I would go over to visit relatives and search all around the house for some type of drug. Usually I would just find the liquor stash, take some shots, and water down the bottle. I know this isn’t easy. But it’s worth it in the long run, your mind and body will thank you. These things take time, it doesn’t happen overnight. But please change something about your lifestyle. You don’t have to quit drugs all together, you can smoke weed and drink and do whatever and be relatively safe as long as you moderate. Life is meant to be lived sober. Don’t do this to yourself man.Good luck to you
dimethyltripreports|There's no easy solution. But one aspect of it is to actively work to change your perspective. Start with reframing your efforts - instead of battling an addiction, work on developing discipline. They're essentially the same thing, but still different in quality. Change your internet searches and overall mindset to reflect that. It's small, but it's real.
walt1o82|You've developed tolerance. Xanax has a really short half life out of all the benzodiazepines. You need to slowly switch over to diazepam which has a much longer half life- up to 100-200 hours in some individuals. Google Dr Ashton Manual Benzodiazepines. That will give you all the knowledge you need to get out of where you are. If you have a decent doctor, take it to him/her and show them. Be honest, show them where you are. Get settled on where you are on your dosage then start cutting down. The good news is that you can manage it all and get off it.The bad news is that it will take time, depending on how much and how long you've been dependent. Your brain hadn't been producing GABA because it's been produced artificially by xanax etc. You'll need to come off the benzodiazepines slowly to give your brain time to start producing GABA again on it's own. But again, good news: your brain will get back to it- it just might take time.One more piece of advice: don't Google benzo addiction withdrawals. The act of doing that will give you withdrawals even if you've not taken a benzo in 4 years- trust me!Good luck :)
xluzibelx|Looks like you have a tendency to develop of addiction, unlike your girlfriend. What should you do to stop? Well, Im still figuring out myself too, but something I can tell you is you have a problem. In the moment you decide to stop and keep doing it, means addiction's growing inside you so either or you go seek for some help NOW or just hide it from the ones around you until it becomes to obvious for them to catch something weird on you. Ending up dead or locked up are some options too. To be honest, beating up addiction alone is as bad as playing russian roulette with a revolver. It depends of course in how grown your addiction is, but if you seriously can't stop by yourself, seek help now before it's to late! I did the same mistake to wait as you and overdosed and nearly died! Doctors said it was a MIRACLE to had woke up with almost not real damage, but a friend of mine who went through the same shit that same night couldn't make it. He passed away.So I'll encourage you to seek help, it's for the best! Best wishes
Modric-87|You are in the right place man. Hope you are ok.
PurpleSweetz|You're not a deadbeat dad for having a disease - that's only running through your mind because of the stigma addiction holds.
Samuelbokay|Sometimes it's minute by minute. It's making each smart decision, one at a time. Family or pick up? Health or pick up? Personal integrity or... Good luck! You can do it.
SebbyHafen|My man, you're not going through this alone. You'll be ok. Make today better than yesterday, one step in front of the other. ❤️
atabadore1999|We’re always here if you need help or just want to vent. You can get through this I promise.
woods8189|Thank you. It will have to be tomorrow, I make better now coz this day already started for me lol
Katsie463|Thank you so much! I'm a week into it. We are doing the tapering method and to my surprise I've actually encountered some improvement at times. Obviously I am in no control of my medications and they are being administered to me. But it's actually been kind of working I think. But I am only a week into it...
SummerBreeze2008|What medications are they giving you? If you don’t mind me asking...
gogomom|You should go - just look up the next meeting and show up.  You don't have to talk, just listen - hell, you don't even have to give them your name.  You don't have to be clean and sober to show up to a meeting, but they ask that you don't share if that is the case.I went to lots of meetings while I was still using - it took a while for it all to sink in.Now clean and sober 8 years.
thecloudsoverhere|a life is a life, no matter what. being a burden to yourself does no good, and this will not change quickly. but, whatever your problem it can change you just need to let yourself be open to change. because honestly drugs aren't always the quickest death. they are just a damn fine way to cut yourself off from letting you truly experience all that life has to offer you. and sure a heroin addict may peak and feel like that is the best experience, but the first time i pushed my own boundaries, from the first time i ran 10km to the first time i felt like videotaping myself doing something (out of pride). i would say those trump and drug experience by miles. a good view i have learned is that we need to let ourselves be open to opportunities, because without those chances, we will never change. we will never know if the grass is greener on the other side, and if it's not then come back to your old way. but i think you will be pleasantly surprised to find out there is beauty all around you, you just have to have the open eyes and ears to see it. i went to AA at the start of my journey and it greatly helped me, i stayed for a short time and realized i needed something other than that, you may not. either way, cutting yourself off is like saying you are not worthy of experiencing all that life has to offer, and that is misguided. everyone should have a chance to change and better themselves, no matter if their mistakes were earlier today, or many years ago. go to the meeting, it may change your perspective on yourself and many other things as well. good luck and have faith in yourself, if nothing else. you deserve it.
Attachmentville|Fellowship is really important for recovery. Another major aspect is honesty. Good luck to you!
Modric-87|Yea Im a sex addict for sure. I only use drugs because it gets me excited for porn and webcamsites. At the beginning I did it too get more social and hook up with girls, porn totally took over my sex experience, girls wont do the job anymore for me. Im gonna visit a meeting again, hope I meet some nice people there.
LolSatan|Best way will be to not go out for a while.
Modric-87|You drink together with cocaine? Can you go without alcohol? Or did you without realising already became an alcoholic. Cocaine and alcohol form a totally new substance in your body: Coca-ethylene. Its much stronger then when you do the 2 substances seperately. Its much harder on your heart aswell. I cant drink anymore without having cocaine with me. So if I were you I would try to ban alcohol in your life and see how you react on that. I know there are people who can still drink now without getting the need to buy coke, because they took a break from all of it for a long time. I hope this is the case with you. Good luck! If you have any questions feel free too ask.
SebbyHafen|Yeah dude that's super rough :( what are your thoughts on switching jobs?
jajsur|Thanks I started doing things outside of work a lot more to keep me active its just when I get here it just so difficult to keep my mind off it.
2010_2010_2010AGAIN|Hello, thanks for posting. I can very much relate to the situation you find yourself in as I have had a weed/adderal problem for quite sometime.  Can I ask how old/how much time has gone by since you were a junior?
imoan-|Thank you for replying! 18 and a Senior in high school, I know it hasn’t been long sense this all started but the way things are progressing are really scaring me. I didn’t see any of this as a problem until very recently
BoobahMacaroni|I overdosed on a synthetic cannabinoid last weekend and almost died. I had to be taken to the hospital. I’m a poly substance drug addict and after that, I decided that I need to change or I’m going to die. I’m trying to get my usage down to just kratom alone but so far it’s been difficult.
SlixxyHonduran|No I’m actually being serious
thecloudsoverhere|i hope you feel better man, sounds like things are rough. take care and babble whenever you need to. sometimes, someone who responds is all you'll need. look inside yourself for the reasons to change, even if they are for other people. know how your actions make you feel about yourself and take steps to become the person you see yourself as in your dreams, eventually that will be the way you are
Hamburglarrrrr|Bribe yourself with positive reinforcement: After a week of no cigarettes I will buy those new shoes I’ve been wanting...a month new video game(s)? Keep it reasonable but worth the splurge. It’s an investment in you ;) My incentive was a one year goal (as I couldn’t remember going that long in 10+ years) and a expensive bike I always wanted
Modric-87|This, i have seen many people quitting sigs with the help of vaping. Worth a try.
NiczymPuma|Allens Carr easy way, read that book.You just need to learn about your addiction to cigarettes and win by logical thinking imo
PoetryfortheHunt|I found that exercising and getting my heart rate up (like going for a run) eliminated the urge altogether. That being said, it was only temporary, and seeing as most people can't run all day everyday this needs to be paired with a mixture of education (on the nature of addiction/ what to expect while quitting), replacing old bad habits with new good ones, and will power. Recovery is a process and it requires a lot of your attention to be successful (more so in the early days) so always look in the direction you want to go, looking in the rear view mirror will only lead you off the road. Good luck, stranger!
imoan-|Start vaping and lower the amount of nicotine with each bottle you buy until you hit 0, or just continue vaping if the health effects are less worrisome to you then the ones caused from smoking (I assume there’s still some negative health effects but don’t know enough to make a claim either way)...personally I got more addicted to nicotine switching to a vape but I wasn’t trying to quit I just didn’t want to be smoking cigs
jpchef|JUUL
whatwouldbuddhadrive|There were 4 things that helped me quit. 1. I asked my mom who had quit 10 years earlier if she still craved cigarettes and she said "No." I knew then that it would just be a waiting game. 2. My dad once made the comment that "...you have to want to be a non-smoker more than a smoker." That stuck with me.3. I stopped going to bars (this was years ago). But drinking in bars and smoking went hand-in-hand for me. I removed myself from that situation.4. Nicorette gum. That first night I was really going through withdrawal and started digging around in drawers. I popped a piece of that gum and ooohhhh yeah craving satisfied. I planned on fully transferring that addiction to nicorette and chew for the rest of my life. Of course, it tastes like shit, so I just eventually quit chewing it--I didn't have to try.
clockworkbuddha|Do they understand what addiction is? It’s not just a disease of poverty, can affect anyone. Implications of working with those with addiction- compassion and clear boundaries- awareness of own shit they bring to the table and where to take that.Importance of team working - God knows the solo flyers who think they know it all are dangerous as hell
catalinachalarka|I know I have to be in my SMART meeting this week. It's pulled me out of hell before and I will always love that community
darkcatwizard|You need to deal with your trauma properly before any real healing can begin to happen. Talk to a therapist you trust. This should be something that happens slowly and dealt with bit by bit. Wishing you the best!
hotcaulk|There are some CBD oils you can try that have no THC, so they will not get you high, but you may still have some relief. The little tobacco shop in my neighborhood that sells bowls and stuff sells that oil, too. You'd have to get a vape pen for it but most people know someone that has an extra one, anyways. You may wanna ask in r/aspergers or r/autism what they use as alternatives to cannabis. (I'm Autistic, that's where I get my info on this stuff. I use pot to manage PTSD/ASD. Quite a few of us on the Spectrum do. It comes up every once and again over there.) We use swings, too. Yes, like the ones you used in the park as a child. They can be very soothing. There are special ones for indoors, too. I like rocking chairs, too. Actually, just google Autism therapy tools/toys. We have a whole arsenal of stuff that may be able to get you through the next week. Those little *fine-tooth* brushes? You brush your arms with them. My SO's kept me out of a sensory melt down with one more than once. A weighted blanket is nice, too, when I get what I call "table flippy hands."
jd_l|There are some good medications for PTSD. I take clonodine, and it helps me tremendously. First you fix the mood, then you fix the behavior. Be strong and keep learning! All the best!
mrtrav50|I made my way into recovery a little over 9 years ago and dont jnow where i would be without all the love i get from my recovery community. Having people around that understand the pain of using and not using is essential.
pimptywin|Are there any health services in your city where you can go to a group or get counseling?
sh0nuff|Hitting up a meeting every day is essential behavior in this stage. Sometimes multiple meetings. If there isn't a SMART available, go to an NA or AA. You don't need to identify what you're there for, you just need the community and a safe place to vent if that's what gets you through. I am a Buddhist, and I got through my first 3 years at NA meetings. I just identified my higher power as an internal locus that I had to tap into through meditation.. I never felt any religious pressure.. Additionally, finding a sponsor, (even if they aren't your official one that's belong you with step work or whatever) that you can text, call, etc... And socializing with the groups.. Usually there's coffee time or pancakes or whatever before / after each meeting...Basically you need to live and breathe recovery 24/7 when you're not sleeping. Avoid any old friends who still use, delete all the numbers for toxicity, no more dealers in your phone etc.You know you can do this. Just lean on us until you can stand on your own. It's ok. We've all been there.
