GunnerMcGrath|> I use quit in quotations because I wasn't ever actually really addicted.Your immediate switch from cigarettes to overeating says otherwise. You may not have been physically addicted, but clearly you are using both cigarettes and food as a coping mechanism. As you say, without them you feel empty inside. Well, the truth is that you STILL feel empty inside even with them, because what can food or cigarettes really do to how you feel deep down inside yourself? They can only distract you from how you feel, which is what addictions are often all about: escaping and numbing pain of one sort or another.So really, rather than looking for some substance or activity to help you avoid that feeling, you need to look at your life and your relationships and work on the reasons you feel empty in the first place.  I'd recommend getting a counselor if you can (don't know if you have health insurance but they are often covered) or even a recovery group. I'm sure there's overeaters anonymous or something, but even AA or NA meetings would likely welcome you in to talk about your addiction, since the addictive substance is really not the primary issue.Good luck to you!
Shitscoolwithme523|I will certainly do that. Thanks for the support my dude
Themermaidmomma|It should settle down soon I quit two months ago and now I finally have my eating under control
dimethyltripreports|Have you tried noopept? I'm not advocating it, but if by chance you haven't heard of it, maybe it's worth considering. There are anecdotal reports of smokers using it successfully to quit. It's a legal non-FDA approved drug that has overlapping binding properties to nicotine (not a naturopathic thing, an actual compound with confirmed pharmacological activity). It's not known to be carcinogenic, *based on limited research,* and isn't addictive. However, some people report a drastic reduction in withdrawal symptoms and related cravings. Perhaps it could help with cravings that transfer from one habit to another.Take the suggestion with a grain of salt, just some niche pharmacology I found interesting.
timmahsound|Bump
Modric-87|Thanks a lot!
_Icore_|Thanks for the post, it's a interesting perspective. I would love to know how it correlates to people with how they differentiate fantasy from reality
Addiction_Redemption|She's not a project! At this stage, if she doesn't want to be fixed, you can be damn well sure you won't be the one to do it!
Evilevilcow|You be sure to do exactly that!
Modric-87|An active addict cant have a healthy relationship. The substance is our nr 1 lover, everything else gets lower on the ladder. I can only speak for myself, but I really cant handle a relationship now, I cant even take care of myself. By getting in an relationship you both get expectations from eachother and I know I never ever can meet those expectation, what leads to more tension and let downs for the other, which then has a huge impact on my mental state and guess who really likes negativity and tension? My addiction. I respect you wanna help this girl, but you dont know what you are facing, or did you deal with addicts before? She needs support, not a relationship. When she has some clean time under her belt (Atleast 1 year, 2 is better) then she can think about getting a relationship. But well I know how love works, It can make you really blind and make everything seem as possible. I hope you can think with a clear head about this and make the right decision.
bolshy_yarblockos|No you shouldn't. It will not turn out well for either of you. I'm sure plenty of people will give you advice about why this isn't going to be good for you but its also important for you to know why this will more than likely end up worse for her.I lived this situation, I was that girl and met a boy who felt the same way as it seems you do. Except addiction is awful and people aren't prepared for it, as good of intentions as they may have. So shit gets real, people freak out and leave. Or they have expectations for an addict that they can't live up to, causing more emotional pain. The more you begin to love her, the harder watching her go through this will be.And you will only have two options. Jump in the fire with her and ruin yourself too or let her go. Which she won't be able to handle because she's already dealing with way too much pain. Her addiction will become worse trying to deal with it. Potentially causing irreversible damage.If you really care about her, be there for her but maintain an emotional distance. If you don't want to become her or push her further out of control, leave her be. You can't simply love people out of addiction with that being the only help they receive. If she's not ready to get clean already, she won't be ready simply because of you.
hi5torimakr|I like how you guys believe that I’m going in there like a mechanic or repair man thinking I’m gonna change parts and fix her up just because I want to. You don’t know the context of the situation and you don’t know if she wants it or not, but I can assure you this isn’t being treated as a project thanks.
littlelunacy|I think that what people are saying is true but it is coming off pretty harshly. You need to understand that you cannot in fact fix her. You both have a codependent relationship, understand that. It is also unwise to just be a “good friend” to her considering your emotional relationship. You are going to have a very hard time just being her friend, I promise you that. I have been in a similar situation and what I’m telling you is that you need to get out of this. You cannot save her and she will pull you down if you try. After a while you will come to resent her because the only person that can save her is herself. Again, the fact that you two have already been romantically involved means that the next step if you want to keep some of your sanity is to emotionally distance yourself from her. The reason why you latched on to what that other person said about just “being a good friend” is because subconsciously that’s exactly what you wanted to hear, but what you don’t understand is that it is the exact opposite of what you need right now. People aren’t telling you these things to be mean. They are saying these things because when you are on the outside looking in, things are a lot clearer. You can’t see yourself or herclearly right now, and that’s the issue. We could miss a whole lot of the story but the fact of the matter is that she is an addict and you will always come second to her addiction. That’s just how it goes. You need to save yourself. You can save no one but yourself, and as long as you remember that you will have better relationships. But the fact that you have this incredible pull to save her is less about her and more about you and the wounds that you have from childhood.  Something about her and her situation mirrors the kind of pain that you feel and the fact that you probably wanted somebody to save you, too. But I am telling you pal, this is not the road that you want to go down. Unfortunately, people telling you the same things over and over again is not going to cause you to change your mind because when you are in a romantic relationship with someone there are chemical changes that happened that cause you to be in it no matter what. Even when it is not in your best interest and in fact will take a toll on your mental health. You’re probably going to choose to go through this and that’s ok, but I just needed to repeat the same truth that others have said. When you come out of this, it will make more sense you and you will wish that you had steered clear and done the hard work. Best of luck to you.
maya_lyubomirsky|you're welcome to PM me if you want! i don't give out personal details of course but am more than happy to discuss the situation via reddit.
peterthedickeater|I can understand your attraction to her. I'm sure there is something about her that is ineffably beautiful, and I'm positive that she is worth loving.However, your title says it: this is not a healthy love. This is a "darker" love, and the truth is, she is not in the right place to deal with the emotional turmoil of a new relationship.It doesn't seem like you are trying to pursue a relationship though, which is admirable. You ask if you should "stay the course, possibly aid her sobriety and help her flourish." There is a reasonable argument for both staying and leaving; unfortunately, you don't give us enough info for me to thoroughly argue my personal opinion, so I will give you both sides.1. You stay. That's a perfectly reasonable choice. However, in doing this, you will need to be COMPLETELY SELFLESS. As in, no expectations at all for what yoru relationship with her will be during or after recovery. Addiction is first and foremost a codependency issue. An addict will absolutely not truly recover if they jump from their drug of choice straight into the arms of some lover... and the scary thing is, she might try. You have to be strong and recognize that in her case, her need for someone is NOT love, even though it might seem like it. She might try to use you as an emotional regulator, thereby turning you into a replacement drug. There's a reason why rehabs don't allow people to enter relationships. In order to recover, she needs to learn how to manage her emotions herself and deal with the issues that might have driven her towards addiction. And, to be completely honest, I highly encourage you to do some searching within yourself as to why you're attracted to someone so clearly troubled. I'm not making any assumptions or trying to psychoanalyze, but the truth is *most* "healthy" people avoid entering a romantic relationship with someone like her. There is definitely a difference between an addict and a typical working adult, and that is a typical adult is self sufficient and will not require constant work around the clock. There is just no way your love interest will be able to contribute to a healthy balanced relationship that you deserve right now. Maybe she will a few years down the line, but you shouldn't take that chance. The person she is now will be VERY different than the person she becomes after recovery. That girl might not be interested in you at all, in fact, she might be angry at you or feel like you were trying to take advantage of her in her vulnerable state. The chances of things actually working out are maybe.... 20%. And within that 20%, there's a great chance of relapse or potential suicide attempts. Try reading "A Million Little Pieces" and its sequel, "My Friend Leonard."2. You leave. You go on to pursue a girl who is much healthier and better for you, staying minimally if at all involved in the addict's life. Or...3. You stay and be her good friend. Trust me, THIS is what she needs right now, and something she will need for the rest of her life. If it helps, imagine that she is your sister, a girl you love unconditionally, and think of the advice you give her and services you render her as if they were for your sister. (these are just examples) Would you advise your sister to enter a relationship immediately after rehab? Would you advise her not to work and let a boyfriend support her? Or would you advise her to get therapy, and to call up a friend or family and vent when she is feeling bad? To keep a list of "emergency numbers" when she is tempted to relapse, etc. If you really love her, you have to love her as a person, with absolutely no expectations. DO NOT SLEEP WITH HER. Do not encourage her to sleep with others. And perhaps, perhaps, if you stay the course, and remain her very good friend for at least ten years (if she can stay sober for 10 years, she has a good chance of staying sober for good, IMO), then perhaps something beautiful can blossom...
thebrightorangedawn|Still living this situation and I am you in this story. If I could go back to the fateful day I decided to try to help and be there for "A", I would have made a VERY different choice than I did as I am still dealing with the aftermath. Addicts are addicts and always will be addicts no matter what.  If she's been to treatment multiple times before, it is improbable that this time will be the cure all. "A" had already been through multiple psych hospitalizations and 2 rehabs when our paths intersected this time (we used to work together and kept in touch a few times a year for the past 5 years). He used everything from weed, to scripts, to mdma, to cocaine, and had been using meth for about 2 months at the time of this intersect. Meth stole my Mom from me emotionally, mentally, and then physically once she died. "A" has an 8 y/o daughter and helping him escape the same fate as my mom so she didn't end up like me (I've got serious abandonment, trust, love, and other issues),  became my goal without me even realizing it. Hindsight is 20/20.In the beginning I tried to keep a distance and just be a friend, but like you I was drawn to him. With my encouragement and support, he started to get clean, he started working again, he was getting healthy again, and then we eventually started dating (BAD IDEA). He told me many of times that having me in his life took away the desire to stop using. The thing about addicts, they don't care about anybody or anything except their drug of choice and that's the truth. His using slowed down but it didn't stop like he had made it seem. When I found out, he said he would go back to treatment. I'll try to spare you the longer of the details, but that was 9 months ago. In the last 9 months he's been to rehab 5 more times and 3 psych stints. 1st - he was there for a week of detox. Came out and relapsed 4 days later. 2nd - he was there for 30 days. I went to every family day, group therapy, I did everything the treatment center said that I could to do that could help and support him including going completely sober myself so that when he got out and came to live with me there would be zero triggers at home. He relapsed 85 days after getting out. After his relapse he 51/50'd himself and was stuck in a maximum psych facility for over a week. When he got out, he then went for a 30 day outpatient program at a different, lower level psych hospital. He relapsed 3 weeks after that program. Over the course of the last 9 months I have spent thousands and thousands of dollars trying to help him. On top of that, he has stolen over $3000+ from me with most of that happening with the very last relapse. I have not seen him since his last relapse in January but I have talked to him over the phone (explanation of why is below). He has told me that when he left me after the last time he relapsed, he went back to treatment again, but he wasn't even there a full 24 hours. He had attempted suicide (and almost succeeded) and they put him on a 14 day 5150 hold in another (different) psych hospital. He called me from the psych hospital, but our conversations were not pleasant (due to the theft and abandonment) and I had decided to write him off for good. Unfortunately, that didn't last long as I shortly thereafter found out that I was pregnant so I got a hold of him to tell him (hence the phone calls).  He tells me he is now in another state in his 8th stint in rehab. He's going to attempt sober living after. I am keeping my distance at this point,  but due to my current circumstances, I am unable to completely cut him off.I tell you this story not to gain sympathy, but as a warning. I have been physically, mentally, emotionally, and financially drained because I was drawn to an addict who had already ruined all other relationships in his life because of his addiction. Because I felt bad for him, I have now put myself into a major life altering situation in which I am still trying to figure out. Addicts need professional help. What I realize now and what I'm about to pass to you is this:If somebody has been through professional treatment multiple times and is still having issues, what do you think you as a non-professional, can REALLY do to help and be there for that person?
0001none|this is very common. http://www.swansea.ac.uk/media-centre/news-archive/2017/scientistsfindthatinternetwithdrawalincreasesheartrateandbloodpressure.phpjust go by general principles of fighting addiction. avoid exposure to the stimulus and distract yourself when you get cravings
MandarinInAYear|From a perspective of somebody slightly older, please don't beat yourself up if you don't achieve everything you want by the time you are 20.You can change as long as you are alive. Changing some habits is really challenging and it's nothing wrong with struggling with them for a while. No one way works for everyone, so it may take you some time before you find what works for you, just don't give up.
OrangePiII|Thanks I just removed internet access from my technology other than my laptop for school and work. My phone and other technology didn't need it. I am going to use the next 90 days to spend less time on the internet and spend time exercising/ sports, and make new friends (and actually spend time with them). Optimistic even if this is going to be difficult.
SebbyHafen|You got this ❤️
avision|Just remember it will only difficult for so long, you'll wake up one day soon and realize you got it.
PurposedPorpoise|Hey, I've been doing exactly this for about 5 months now. In that time I've only done blow once and am now going weeks at a time without nicotine. I vaped for years, it broke so I decided to quit, bought a few packs here and there and bummed some smokes but I'm pretty much at 0 now.Changing up your habits, especially weekend habits, is crucial. Don't hang out with your friends that use. Delete your dealers' numbers. If you can, move. Try and reconnect with sober/less sketchy friends, go do activities that are fun sober. I got a dog and she really gives me the will to do better, but that's a big undertaking so I don't necessarily recommend it.When I'm really itching to do blow I remember what it's gonna be like when it's all gone. Up for hours feeling like shit, not wanting to do anything but not being able to sleep. When you think about that way just going to bed seems a lot better.It's gonna be really hard to quit both at once, they're both addictive stimulants. You're gonna be irritable and on a hair trigger sometimes. You might just wanna try quitting coke first, that's the greater of the evils.And of course, think of the money you'll save. I went from being constantly in overdraft, credit card debt, sometimes even worried about how I'd eat until payday to having savings, never going below 0 in my checking, paying my credit card in full every month. That shit feels really good.
Peoplespostmodernist|Yeah, I'm with u/mockassin. Semantics all the way. I understand the point of the article but it really does nothing to address the problem at hand. What I'd be more curious to see are studies looking at the likely babies born dependent on drugs are of developing full fledged "addictions" later in life. There's lots a data on children being prescribed  stims for ADD who grow up to become addicted to meth,coke ext so I wouldn't think it would be too far-fetched to assume that opioid dependence could be a precursor for addiction later in life.
mockassin|>Maybe you meant the ultimate impact is the samethus semantics . trying to avoid the loaded term in favor of a more benign one.
theaddictedlawyer|Since the two clinical definitions are different not sure how it can be semantic.  Maybe you meant the ultimate impact is the same.
yellowmush|🙌🏻
TNpitt-mama|I would try [SMART Recovery]( https://www.smartrecovery.org).  They offer an alternative to AA/NA but Smart Recovery is evidence-based and does not revolve around religion/spirituality.  I would check out their resource section, should be plenty of tools available for free or you can order a $10 workbook of the same material. They also list additional readings that may be useful to you. They have online & local meetings, in some areas at least, if thats your thing. I copied the following from their website:SMART Recovery is the leading self-empowering addiction recovery support group. Our participants learn tools for addiction recovery based on the latest scientific research and participate in a world-wide community which includes free, self-empowering, science-based mutual help groups.
JayMaya|Wow. You've been through Hell. I think you are doing the right thing but cautioning yourself. I understand you love her but sometimes it's important to feel safe more than feeling that love. Safety matters for your kid more than anything.She may be clean now but that 'unknown, scared' feeling to live with each day by giving her that 2nd chance back into your life as your partner is not worth it, in my opinion. I just got out of a relationship with an addict (i am 23F, he was my BF in middle school too we have a very deep connection/relationship). I realized, i'd rather break my heart ONCE and heal with time, or learn to cope with the heartbreak, than have my heart break each and every day by being with him. I believe that we are deserving of healthy lifestyles. It sucks that we are capable of falling in love with people who have a mental disease. These people are not inherently bad people, but they do have a disease that actually makes them bad people, unfortunately.
Paask_en|Honestly wish I could help here, but I'm too young to give any advice on marriage and especially when there's A kid involved, but it sounds like you need her to really prove herself, be completely honest and see if you can end up trusting her again, because if you don't and you end up together, you'll probably just keep being suspicious and think about all the bad stuff, and it'll make you miserable (only talking from experience of extreme trust breach in A previous relationship, but again, quite young, so probably not the same as your situation at all)...Hope you find out something for the sake of you and your kid, and hope she gets better too and that she's changed... Wishing the best of luck and positive thoughts to you, your kid and her! Wish I could give better advice
SDsurfx|Wow, great perspective from someone so young. Me heart has slowly been breaking all those nights she was gone. I’ve slowly been emotionally detaching. Feels tough to go back. I don’t even feel like letting her touch me most days.
florabundawonder|In my opinion you have already done more than many people would. For the sake of yourself and your child you are doing the right thing. You can't "fix" her - she has to do that for herself. I was an addict before I got with my now husband, and he told me that if I was to carry on using or go back to it, he would never be able to be with me. I did not doubt him for a second and I have been clean since. It was something I wanted to do for myself anyway but his firm stance on it really helped me. Stick to the course you're on, be a good dad, facilitate her seeing the child under supervision if she stays sober. But don't go back to her at this point in time. She has lied and cheated, made bad choices and put your child at who knows what risk? She needs to see that there are heavy consequences for that. Be strong.
twinkie45|You’re playing with fire here because at a certain point CPS will take the child if you keep allowing your wife to come home and she keeps relapsing. I’m not saying you have to give up on her or all hope is lost, but you have to protect your child before you worry about your marriage. I’d consider requiring her to live elsewhere with a set plan/schedule to rebuild your family. It should include family and individual counseling for all of you, only supervised contact with your child, and random drug tests from Walmart/drug store. If she can meet all of the conditions without a relapse for anywhere from 6-12 months you can talk about her coming home.
witherspleen|I put an ex partner through a hell that was not as severe as this, but it still wasn’t pretty. I never managed to get fully clean and sober until almost a year after we broke up (her call, and a good call). But the years of slowly increasing lying and hiding and denials and counter-accusations, even after I had given up booze for the last half year or so, had done its damage. Even if we had stayed together, with everything that my addictions put us through, I don’t believe we would have ever recovered to the point of it being a healthy, balanced relationship. That was six years ago, the last over five of which I’ve been clean and sober. Looking back on it now, I can definitely say it was the right call. Had it gotten much worse, it would have ended sooner and in a more explosive fashion rather than the way we parted ways, on quite good terms. I can’t imagine how having a kid together would have impacted that, but for you, I think staying together  even for the sake of raising a kid would be stopping you from finding truer happiness wirh a life partner. If she is truly clean and sober, and you can stay friends or at least on good terms if you end the relationship, there’s no reason not to in my mind, as sad as I feel recommending that. Even if you can’t stay on good terms, if you realize that you can’t spend the rest of your life growing old with this person, you better pull the plug on trying to make the life-partner end of it work, and look at some options to move forward. The kid complicated things, but I’m sure you’re both committed to raising your child in the best way possible. And that probably involves being in a healthy relationship. Which may not be with each other.
